<?xml version="1.0" encoding="UTF-8"?>
<!-- Autor: Sasha. Fecha de creaciÃ³n: 25/2/2021 -->

<catalogo
    xmlns:xsi='http://www.w3.org/2001/XMLSchema-instance'
    xsi:noNamespaceSchemaLocation='catalogo.xsd'>
    
    <portatil>
        <ref>HP10219</ref>
        <nombre>DA0204NS</nombre>
        <fabricante nombre="HP"/>
        <procesador>
            <nombreproc>I3-7020U</nombreproc>
            <cache tamanyo="GB">500</cache>
            <numero>1</numero>
            <vel>1</vel>
        </procesador>
        <ram>
            <memoria tamanyo="TB">1</memoria>
            <tipo>DDR4</tipo>
        </ram>
        <disco>
            <tamanyodisco tamanyo="GB">256</tamanyodisco>
            <tipodisco>SSD</tipodisco>
        </disco>
        <pantalla>
            <dimension>15.6</dimension>
            <resolucion>1266x768</resolucion>
            <max_resolucion>1366x768</max_resolucion>
        </pantalla>
    </portatil>
    <portatil>
        <ref>LV14583</ref>
        <nombre>IDEAPAD</nombre>
        <fabricante nombre="Lenovo"/>
        <procesador>
            <nombreproc>I3-8145U</nombreproc>
            <cache tamanyo="TB">1</cache>
            <numero>1</numero>
            <vel>1</vel>
        </procesador>
        <ram>
            <memoria>16</memoria>
            <tipo>DDR4</tipo>
        </ram>
        <disco>
            <tamanyodisco tamanyo="MB">51200</tamanyodisco>
            <tipodisco>HDD</tipodisco>
        </disco>
        <pantalla>
            <dimension>15.6</dimension>
            <resolucion>1266x768</resolucion>
            <max_resolucion>1366x768</max_resolucion>
        </pantalla>
        <grafica>Intel UHD Graphics 620</grafica>
        <foto>portatillenovo.jpg</foto>
        <foto>portatillenovo.png</foto>
    </portatil>
</catalogo>
